{
  "schema_name": "approval_record",
  "schema_version": "1.0.0",
  "artifact_id": "art_approval_edits",
  "project_id": "prj_demo",
  "revision_id": "rev_001",
  "created_at": "2026-07-22T10:00:00Z",
  "producer": {
    "application_version": "0.1.0",
    "stage": "example",
    "adapter": "fixture",
    "adapter_version": "1"
  },
  "inputs": [
    {
      "artifact_id": "art_proposals",
      "sha256": "eeeeeeeeeeeeeeeeeeeeeeeeeeeeeeeeeeeeeeeeeeeeeeeeeeeeeeeeeeeeeeee"
    }
  ],
  "config_sha256": "0000000000000000000000000000000000000000000000000000000000000000",
  "approval_id": "apr_edits_001",
  "approval_type": "edit_batch",
  "actor": "operator@example.com",
  "role": "editor",
  "decision": "approved",
  "reason": "Approved conservative mechanical cuts",
  "approved_item_type": "edit_proposals",
  "approved_item_sha256": "eeeeeeeeeeeeeeeeeeeeeeeeeeeeeeeeeeeeeeeeeeeeeeeeeeeeeeeeeeeeeeee",
  "expires_at": null,
  "budget": null
}
